{
  "schema": "app_fabric_mobile_operating_context@1",
  "snapshot_id": "AF-MOBILE-OPERATING-CONTEXT-2026-08-03",
  "as_of": "2026-08-03",
  "contract": {
    "schema_path": "docs/start/app-fabric-mobile-operating-context.schema.json",
    "markdown_companion": "docs/start/app-fabric-mobile-operating-context.md",
    "sync_status": "independently-reviewed"
  },
  "repository": {
    "planning_freeze": {
      "ref": "origin/main",
      "sha": "2de105e001ab8029eb21bce4691eded49e48ff81"
    },
    "observed_destination": {
      "ref": "origin/main",
      "sha": "2020fb3c9b07b56eba810a5f6d7419816ba55735",
      "observed_on": "2026-08-03"
    },
    "integration_refresh": {
      "required": true,
      "classification": "Class D",
      "merge_base_sha": "2de105e001ab8029eb21bce4691eded49e48ff81",
      "overlap_paths": [
        "scripts/check-doc-examples.sh"
      ],
      "overlap_assessment": "disjoint_hunks_no_predicted_text_conflict",
      "proof_status": "not_destination_current_rerun_required"
    },
    "planning_branch": "docs/app-fabric-mobile-m0",
    "implementation_branch": "fix/app-fabric-mobile-readiness-containment",
    "implementation_base_sha": "a9b3646289689de824c0fbde3fdb805312fbb196",
    "clean_isolated_worktree_required": true,
    "source_work_admitted": true,
    "active_assignment": {
      "card": "M0-05",
      "status": "reviewed_go_with_conditions_pending_commit_and_integration",
      "admission_basis": "human_directed_accelerated_pre_candidate_containment",
      "producer_role": "Coding Agent",
      "review_route": "framework_pr_review_comprehensive_adversarial",
      "integration_disposition": "refresh_required_pending",
      "write_roots": [
        "agent_skills/product-mobile-react-native/SKILL.md",
        "app_gen/src/bin/appfw_introspect.rs",
        "scripts/appfw",
        "scripts/check-doc-examples.sh",
        "scripts/dependency-check.py",
        "scripts/ci/release-evidence-check.sh",
        "scripts/mobile-readiness-containment.test.py",
        "docs/architecture/concerns/maintainability.md",
        "docs/architecture/concerns/north-star-wave-0.md",
        "docs/architecture/concerns/north-star-wave-0-specs.md",
        "docs/frontend/mobile-react-native.md",
        "docs/reference/cli.md",
        "docs/release/deployment-reference.md",
        "docs/release/roadmap.md",
        "docs/specs/app-fabric-mobile-m0-seam-freeze.md",
        "docs/specs/app-fabric-mobile-ux-master-plan.md",
        "docs/strategy/app-framework-product-management-strategy.md",
        "docs/strategy/product-development-north-star.md",
        "docs/start/branch-integration-model.md",
        "docs/start/app-fabric-mobile-operating-context.md",
        "docs/start/app-fabric-mobile-operating-context.json",
        "docs/start/app-fabric-mobile-operating-context.schema.json",
        "examples/products/crm/mobile/.appfw-mobile/device-evidence.json",
        "examples/products/crm/mobile/.appfw-mobile/store-track-evidence.json",
        "examples/products/crm/mobile/__tests__/mobile-contract.test.ts"
      ],
      "stop_rule": "no_candidate_release_distribution_ota_store_or_broader_mobile_source_claim"
    }
  },
  "review_history": [
    {
      "sequence": 1,
      "review_kind": "framework_pr_review_comprehensive",
      "source_state": "pre_raw_staging_fix_uncommitted",
      "status": "NO-GO",
      "severity_counts": {
        "blockers": 0,
        "critical": 1,
        "important": 3,
        "should_address": 1,
        "nice_to_address": 0
      },
      "conditions_captured": "not_applicable",
      "resolution": "Raw staged U5 sources now require strict JSON with unique object keys and readiness fields that are absent or exact false; failures report path/type/value, unsafe or stale targets are deleted, safe inputs are canonically serialized, downstream consumers reject nested/type-confused/duplicate-key evidence, and the exact-state comprehensive rereview accepted the repairs with the destination-current Integration condition."
    },
    {
      "sequence": 2,
      "review_kind": "framework_pr_review_comprehensive",
      "source_state": "exact_uncommitted_39_path_manifest_440f1b07742960336b2164a8e66a91cbc71c87497aa420db5a7f8a2ad5cacebf",
      "status": "GO WITH CONDITIONS",
      "severity_counts": {
        "blockers": 0,
        "critical": 0,
        "important": 1,
        "should_address": 0,
        "nice_to_address": 0
      },
      "conditions_captured": "yes",
      "resolution": "The exact reviewed tree may be committed. After commit, handoff and review evidence must be rebound to that SHA before push. Integration must refresh from origin/main@2020fb3c9b07b56eba810a5f6d7419816ba55735 or newer, preserve isolated PDS expected-failure artifacts, and rerun the full Class D proof plus comprehensive review on the assembled SHA before merge, Candidate, or any readiness claim. CRM mobile Jest and online cargo-audit/cargo-deny remain explicit pre-candidate evidence gaps, not accepted risk."
    }
  ],
  "lifecycle": {
    "stage": "prototype_pre_candidate",
    "delivery_profile": "accelerated",
    "maturity": "experimental",
    "candidate_ready": false,
    "release_ready": false,
    "release_authority": "none"
  },
  "authority": {
    "priority_posture": "docs/release/roadmap.md",
    "live_work_admission": [
      "docs/specs/product-increment-portfolio.json and validated Product Increment plans",
      "program flow controller topology"
    ],
    "integrated_plan": "docs/release/app-fabric-master-implementation-plan.md",
    "normative_mobile_contract": "docs/specs/hosted-product-factory.md",
    "target_architecture": "docs/architecture/hosted-product-factory-architecture.md",
    "technical_plan": "docs/specs/app-fabric-mobile-ux-master-plan.md",
    "bok_commit": "046e532c0e41b6911171f3d9aa961c0898d66140",
    "bok_posture": "draft_rules_evidence_and_open_gates_preserved",
    "not_granted": [
      "product_acceptance",
      "enterprise_architecture_ratification",
      "wip_admission",
      "source_ownership",
      "funding",
      "risk_acceptance",
      "candidate_promotion",
      "store_submission",
      "release",
      "merge",
      "push"
    ]
  },
  "decisions": [
    {
      "id": "channel_projection",
      "status": "proposed_freeze",
      "value": "shared_semantics_separate_web_ios_android_layout_and_behavior"
    },
    {
      "id": "renderer_vocabulary",
      "status": "proposed_freeze",
      "projections": ["web-dom", "native-ios", "native-android"],
      "size_classes": ["compact", "medium", "expanded"]
    },
    {
      "id": "reference_target",
      "status": "bounded_hypothesis",
      "value": "react_native_expo",
      "enterprise_standard": false,
      "business_channel_mandate": false
    },
    {
      "id": "native_auth",
      "status": "proposed_freeze_implementation_open",
      "value": "oidc_authorization_code_pkce_public_client_no_embedded_secret"
    },
    {
      "id": "prototype_build_custody",
      "status": "provisional",
      "value": "enterprise_or_developer_controlled_local_synthetic_only"
    },
    {
      "id": "fabric_application_identity",
      "status": "proposed_freeze",
      "value": "registry_mints_durable_app_id_pending_fixtures_use_null_app_id_and_local_only_prototype_ref",
      "self_minting_allowed": false
    },
    {
      "id": "candidate_build_custody",
      "status": "parked_decision"
    }
  ],
  "m0_artifacts": [
    {
      "id": "master_plan",
      "path": "docs/specs/app-fabric-mobile-ux-master-plan.md",
      "status": "planning_complete"
    },
    {
      "id": "M0-00",
      "path": "docs/specs/app-fabric-mobile-technology-evaluation-brief.md",
      "status": "planning_complete"
    },
    {
      "id": "M0-01",
      "paths": [
        "docs/specs/app-fabric-experience-contract.schema.json",
        "docs/specs/app-fabric-experience-contract.example.json"
      ],
      "status": "planning_contract_only"
    },
    {
      "id": "M0-01A",
      "path": "docs/architecture/adr/0017-web-native-experience-projection-boundary.md",
      "status": "prototype_architecture_accepted_implementation_open"
    },
    {
      "id": "M0-02",
      "paths": [
        "docs/specs/app-fabric-mobile-api-seam.md",
        "docs/specs/app-fabric-mobile-api-compatibility.graphql"
      ],
      "status": "wire_specified_executable_red_test_not_admitted"
    },
    {
      "id": "M0-03",
      "paths": [
        "docs/specs/app-fabric-mobile-manifest-profile.schema.json",
        "docs/specs/app-fabric-mobile-manifest-profile.example.json",
        "docs/specs/app-fabric-mobile-auth-profile.schema.json",
        "docs/specs/app-fabric-mobile-auth-profile.example.json"
      ],
      "status": "fail_closed_prototype_planning_contracts_runtime_and_semantic_checkers_open"
    },
    {
      "id": "M0-04",
      "path": "docs/specs/app-fabric-mobile-build-custody-decision.md",
      "status": "prototype_posture_recorded_candidate_decision_parked"
    },
    {
      "id": "M0-05",
      "path": "docs/specs/app-fabric-mobile-ux-master-plan.md",
      "status": "go_with_conditions_pending_commit_and_destination_current_integration"
    },
    {
      "id": "M0-freeze",
      "path": "docs/specs/app-fabric-mobile-m0-seam-freeze.md",
      "status": "proposed_freeze_pending_exact_commit_and_integration_disposition"
    }
  ],
  "blockers": [
    {
      "id": "mobile_api_wire_mismatch",
      "severity": "blocker",
      "detail": "Generated mobile selects nodes/pageInfo/totalCount, maps semantic JsonValue to a nonexistent GraphQL JsonValue scalar, and uses ID while the generated backend exposes items/page fields, JSON, and String",
      "blocks": ["reference_journey", "native_readiness", "candidate", "ota"]
    },
    {
      "id": "legacy_mobile_false_readiness",
      "severity": "blocker",